category,name,price,description,image,Category
Computer Cases,NZXT H510 - Compact ATX Mid-Tower Case - Front I/O USB Type-C Port - Tempered Glass Side Panel - White/Black (CA-H510B-W1),123.99,null,https://multimedia.bbycastatic.ca/multimedia/products/500x500/143/14301/14301386.jpg,Computer Cases
Computer Cases,Thermaltake Versa H15 M-ATX Gaming Chassis,64.99,null,https://multimedia.bbycastatic.ca/multimedia/products/500x500/104/10441/10441702.jpg,Computer Cases
Computer Cases,Cougar Conquer 2 PC Gaming Case,479.99,null,https://multimedia.bbycastatic.ca/multimedia/products/500x500/147/14759/14759768.jpg,Computer Cases
Computer Cases,"Segotep Gank 5 Gaming Computer case Support ATX, Micro-ATX, Mini-ITX Mid Case.Tempered Glass Side Panel, ATX Mid Tower, PC Case Black",119.99,null,https://multimedia.bbycastatic.ca/multimedia/products/500x500/147/14797/14797683.jpg,Computer Cases
Computer Cases,NZXT H510 - Compact ATX Mid-Tower Case - Front I/O USB Type-C Port - Tempered Glass Side Panel - Black (CA-H510B-B1),123.99,null,https://multimedia.bbycastatic.ca/multimedia/products/500x500/143/14301/14301388.jpg,Computer Cases
Computer Cases,"HYTE Y60 Modern Aesthetic Dual Chamber Mid-Tower ATX Computer Gaming Case Only, White",301.99,null,https://multimedia.bbycastatic.ca/multimedia/products/500x500/164/16448/16448360.jpeg,Computer Cases
Computer Cases,Razer Tomahawk Mini-ITX Computer Case,239.99,"Mini tower case is a compact design that is perfect for users who want to keep their computers portableFront panel connectivity enables easy and effortless access to devicesDual-sided tempered glass panels offer an unobstructed view of the case's interiorVents at the top and rear dissipate heat to keep the case coolBuilt-in air filters at the front vent improve the airflow and reduce the intake of dust particles to keep the case's interior cleanerSPCC steel and tempered glass construction keep the case durableChroma-enabled hardware is durable with easy-to-open doors for customization of the case without using toolsSFX / SFX-L power supply ensures low-noise operationRazer Chroma RGB customizable lighting lets you enjoy a more immersive gaming experience16.8 million colours and a suite of effects allow syncing the case with the rest of battle station to take your gameplay to another levelSupports up to 240mm radiators that keep the case's content coolSpacious design allows you to maximize the cooling capabilities of the systemOne USB 3.2 Gen 2 Type-C port, 2 standard USB 3.2 Gen 1 Type-A ports, a dedicated mic port, and 1 mic/headphone combo port for easy connectivity to peripheralsThree expansion slots enable you to add compatible components like graphic cardsRazer Tomahawk Gaming Chassis includes cut-outs to accommodate cables to prevent airflow and keep the system clutter-freeFits Mini-ITX and Mini-DTX motherboards that help build a custom computer",https://multimedia.bbycastatic.ca/multimedia/products/500x500/155/15552/15552811.jpg,Computer Cases
Computer Cases,NZXT H510 Elite - Premium Mid-Tower ATX PC Case - Dual-Tempered Glass Panel - Integrated RGB Lighting - White (CA-H510E-W1),199.99,null,https://multimedia.bbycastatic.ca/multimedia/products/500x500/143/14301/14301387.jpg,Computer Cases
Computer Cases,NZXT H510i Compact ATX Mid-Tower PC Case - Tempered Glass Side Panel - Integrated RGB Lighting - White/Black (CSE-CA-H510I-W1),126.99,null,https://multimedia.bbycastatic.ca/multimedia/products/500x500/143/14309/14309330.jpg,Computer Cases
Computer Cases,CPU Holder for under desk mount adjustable to fit almost any CPU Computer Tower,45.99,null,https://multimedia.bbycastatic.ca/multimedia/products/500x500/123/12315/12315415.png,Computer Cases
Computer Cases,ASUS - ASUS ROG Strix Helios GX601 White Edition RGB Mid-Tower Computer Case,503.99,null,https://multimedia.bbycastatic.ca/multimedia/products/500x500/151/15108/15108278.jpeg,Computer Cases
Computer Cases,ASUS TUF Gaming GT301 Mid-Tower ATX Computer Case,134.99,"Mid-tower computer case is designed to support your ATX, Micro-ATX, or Mini-ITX motherboard (each sold separately)Two 2.5""/3.5"" drive bays and four 2.5"" drive bays provide plenty of room to connect your storage drivesDurable steel frame with a tempered glass side panel protects your equipment while allowing you to show it off in sleek styleThree 120 mm ARGB and one 120 mm fans keep your system cool and running at peak performanceThree fans are equipped with RGB lighting that can be customised with the ASUS Aura RGB softwareSeven rear expansion slots, one 3.5mm input/output, and two USB Type-A (USB 3.1/USB 3.2 Gen 1) ports make it easy to connect a wide range of peripheralsIncludes a headset hanger so you can keep your headphones close at hand",https://multimedia.bbycastatic.ca/multimedia/products/500x500/155/15569/15569514.jpg,Computer Cases
Computer Cases,Corsair 7000D Airflow Full-Tower ATX Computer Case,298.99,"Compatible with Mini-ITX, Micro-ATX, ATX, and E-ATX (305mm x 277mm) motherboardsFull-tower case grants you plenty of space to install many components and create custom cooling configurationsTool-free tempered glass side panel adds a futuristic aesthetic and lets you show off your high-profile hardwareSteel and plastic construction is sturdy, robust, and long-lastingCustomisable side fan mounts make it easy to mount four 120mm fans or one 420mm radiator for efficient heat dissipationAccommodates six 2.5 inches/3.5 inches combo drive trays, four 2.5 inches SSD mounts, and three-slot GPU mount for expanding your PC with all the storage or performance you needCustomisable windowed PSU shroud lets you add your own personalised inserts for a stylish lookFour USB 3.0 ports, one USB 3.1 Type-C port, and one headphone/mic jack at the front for plugging in smartphones, storage drives, headsets and other compatible devicesThree 140mm CORSAIR AirGuide fans (included) with PWM Repeater and anti-vortex vanes provide the necessary air circulation to keep the hardware coolSteel front panel with a high airflow ensures an optimal temperature and ventilation on the insideThe massive interior accommodates up to twelve 120mm or seven 140mm cooling fans and three 360mm radiators simultaneously or two 420mm radiators for an exceptional cooling performanceCORSAIR RapidRoute Cable Management System lets you maintain that clean and cluttered look thanks to the hidden channel behind the motherboard for routing your cablesHinged side panel and removable front and roof panels ensure a tool-free access to the hardware components",https://multimedia.bbycastatic.ca/multimedia/products/500x500/158/15820/15820057.jpg,Computer Cases
Computer Cases,MSI Case GUNGNIR110R Mid Tower Tempered Glass 7 Slots USB ATX/mATX/Mini-ITX Black Retail,127.99,null,https://multimedia.bbycastatic.ca/multimedia/products/500x500/150/15064/15064817.jpg,Computer Cases
Computer Cases,Razer Tomahawk Mid Tower ATX Computer Case,279.99,"Mid tower is capable of accepting high-end graphics cards to improve your gaming experienceFront panel connectivity enables easy and effortless access to devicesDual-sided tempered glass panels offer an unobstructed view of the case's interiorVents at the top and rear dissipate heat to keep the case coolBuilt-in air filters at the front vent improve the airflow and reduce the intake of dust particles to keep the case's interior cleanerSPCC steel and tempered glass keep the case durableChroma-enabled hardware is durable with easy-to-open doors for customization of the case without using toolsATX (Max-Length 210mm) power supply is efficient, saves power and space, and is compatible with most modern motherboardsRazer Chroma RGB customizable lighting lets you enjoy a more immersive gaming experience16.8 million colours and a suite of effects for syncing the case with the rest of battle station to take your gameplay to another levelAccommodates up to two 140mm or two 120mm fans with removable dust filters at the top, up to three 120mm or two 120mm fans at the front, up to a 120mm rear fan up, and up to two 120mm fans above the PSU shroud to maximize the coolingSupports up to 360mm radiators to improve the cooling of the interiorSpacious design allows you to maximize the cooling capabilities of the systemOne USB 3.2 Gen 2 Type-C port, two standard USB 3.2 Gen 1 Type-A ports, a dedicated mic port, and one mic/headphone combo port for easy connectivity to peripheralsSeven expansion slots enable you to add compatible components like graphic cardsRazer Tomahawk metal gaming chassis includes cut-outs to accommodate cables to prevent airflow and keep the system clutter-freeCompatible with E-ATX / ATX / Micro-ATX / Mini-ITX (Max 280mm Wide) motherboards that help build a custom computer",https://multimedia.bbycastatic.ca/multimedia/products/500x500/155/15552/15552812.jpg,Computer Cases
Computer Cases,Corsair iCUE 5000X RGB Mid-Tower ATX Computer Case - White,234.99,"Compatible with Mini-ATX, Micro-ATX, ATX, and E-ATX (305mm x 277mm) motherboards (sold separately)Premium mid-tower case lends an attractive look to your PC setup and comes equipped with ample internal space to fit advanced hardwareFour tool-free, see-through tempered glass panels elevate your PC with attractive RGB lighting effects from compatible internal hardware (sold separately)Solid steel and plastic construction offers long-lasting durabilityIntegrated motherboard tray with customisable fan mounts allows you to mount up to three 120mm fans or a radiator up to 360mm in size to enhance your PC's cooling performanceSpacious interior accommodates up to three 2.5"" SSDs and two 3.5"" HDDs along with up to ten 120mm or four 140mm cooling fans and up to 360mm radiator at the front and top panelsThree 120mm Corsair SP RGB Elite fans use innovative AirGuide anti-vortex vanes to improve cooling efficiency with concentrated internal airflowEight individually addressable RGB LEDs on each fan offer bright, colourful illumination around your setupIntuitive Corsair iCUE and Corsair Lighting Node Core software allow you to synchronise and customise the RGB lighting as requiredInnovative Corsair RapidRoute cable management system features a single, 25mm hidden channel behind the motherboard to help you organise all major cables easily without any clutterModern front input/output panel comes equipped with one USB Type-C port, two USB 3.0 ports, and one combined audio/microphone jack for effortless connectivity with USB flash drives, keyboards, mice, headphones, and more (sold separately)",https://multimedia.bbycastatic.ca/multimedia/products/500x500/152/15260/15260467.jpg,Computer Cases
Computer Cases,ASUS TUF Gaming GT501 Mid-Tower ATX Computer Case - Grey,199.99,"Mid-tower computer case is designed to support your EATX, ATX, Micro-ATX, or Mini-ITX motherboard (each sold separately)Four 2.5""/3.5"" drive bays and three 2.5"" drive bays provide plenty of room to connect your storage drivesDurable steel frame with a tempered glass side panel protects your equipment while allowing you to show it off in sleek styleThree 120 mm RGB and one 140 mm PWM fans keep your system cool and running at peak performanceThree fans are equipped with RGB lighting that can be customised with the ASUS Aura RGB softwareNine rear expansion slots, one 3.5mm input/output, and two USB Type-A (USB 3.1/USB 3.2 Gen 1) ports make it easy to connect a wide range of peripheralsTop carrying handles provide portability for on-the-go convenience",https://multimedia.bbycastatic.ca/multimedia/products/500x500/155/15569/15569513.jpg,Computer Cases
Computer Cases,Corsair iCUE 5000X RGB Mid-Tower ATX Computer Case - Black,234.99,"Compatible with Mini-ATX, Micro-ATX, ATX, and E-ATX (305mm x 277mm) motherboards (sold separately)Premium mid-tower case lends an attractive look to your PC setup and comes equipped with ample internal space to fit advanced hardwareFour tool-free, see-through tempered glass panels elevate your PC with attractive RGB lighting effects from compatible internal hardware (sold separately)Solid steel and plastic construction offers long-lasting durabilityIntegrated motherboard tray with customisable fan mounts allows you to mount up to three 120mm fans or a radiator up to 360mm in size to enhance your PC's cooling performanceSpacious interior accommodates up to three 2.5"" SSDs and two 3.5"" HDDs along with up to ten 120mm or four 140mm cooling fans and up to 360mm radiator at the front and top panelsThree 120mm Corsair SP RGB Elite fans use innovative AirGuide anti-vortex vanes to improve cooling efficiency with concentrated internal airflowEight individually addressable RGB LEDs on each fan offer bright, colourful illumination around your setupIntuitive Corsair iCUE and Corsair Lighting Node Core software allow you to synchronise and customise the RGB lighting as requiredInnovative Corsair RapidRoute cable management system features a single, 25mm hidden channel behind the motherboard to help you organise all major cables easily without any clutterModern front input/output panel comes equipped with one USB Type-C port, two USB 3.0 ports, and one combined audio/microphone jack for effortless connectivity with USB flash drives, keyboards, mice, headphones, and more (sold separately)",https://multimedia.bbycastatic.ca/multimedia/products/500x500/152/15260/15260470.jpg,Computer Cases
Computer Cases,Corsair 5000D Airflow Mid-Tower ATX Computer Case - White,229.99,"Compatible with Mini-ITX, Micro-ATX, ATX, and E-ATX (305mm x 277mm) motherboards (sold separately)Mid-tower PC cabinet features a show-piece worthy design to add visual appeal to your computer setupHigh airflow-optimised front steel panel offers enhanced cooling by enabling optimum ventilation to the system's interiorTool-free transparent tempered side glass panel showcases your high-end hardware with bright RGB lighting effectsHigh-quality steel and plastic build lasts for years to comeDedicated motherboard tray with customisable fan mounts makes it easy to side-mount up to three 120mm fans or a 360mm radiator for flexible cooling optionsSpacious internal space can hold up to three 2.5"" SSDs and two 3.5"" HDDs along with up to ten 120mm or four 140mm cooling fans at the front/side panels, and a 360mm push/pull radiator at the roofTwo USB 3.0 ports, one USB 3.1 Type-C port, and one headphone/microphone combo jack at the modern front I/O panel provide an array of peripheral connectivity optionsTwo 120mm Corsair fans use advanced AirGuide anti-vortex vanes to concentrate internal airflow for top-notch cooling performanceConvenient Corsair RapidRoute cable management system with 25mm single, hidden channel space behind the motherboard enables effortless cable routing without any visible clutterRemovable front and roof panels allow for easy installation and cleaning of internal components when required",https://multimedia.bbycastatic.ca/multimedia/products/500x500/152/15260/15260469.jpg,Computer Cases
Computer Cases,Corsair iCUE 4000X RGB Mid-Tower ATX Computer Case - White,184.99,"Compatible with Mini-ITX, Micro-ATX, ATX, and E-ATX (305mm x 277mm) motherboards (sold separately)Compact, mid-tower case offers enough space for advanced hardware to build a high-performing PCDedicated front ventilation channels enable optimal airflow into the case for quick and efficient coolingTempered glass side and front panels showcase your components in style with attractive RGB lighting effectsHigh-quality steel and plastic construction lasts for years of intense useFeatures ample room to fit up to 2 SSDs, 2 HDDs, and six 120mm or four 140mm cooling fans, along with multiple radiators including a 360mm in the front and 280mm on the roof (dependent on RAM height)Three built-in 120mm AirGuideRGB fans use anti-vortex vanes to further improve your system's cooling with concentrated airflowEight individually addressable RGB LEDs on each fan illuminate the rig with bright, attractive lighting effectsCorsair iCUE and Corsair Lighting Node Core software help synchronise and adjust the lighting for up to 6 cooling fans as requiredCorsair RapidRoute cable management system features a 25mm single channel behind the motherboard for neat and clutter-free organisation of all major cables of your componentsModern front I/O panel equipped with one USB 3.0 port, one USB 3.1 Type-C port, and one headphone/microphone combo jack allows for easy device connectivity",https://multimedia.bbycastatic.ca/multimedia/products/500x500/152/15260/15260471.jpg,Computer Cases
Computer Cases,Corsair 5000D Airflow Mid-Tower ATX Computer Case - Black,229.99,"Compatible with Mini-ITX, Micro-ATX, ATX, and E-ATX (305mm x 277mm) motherboards (sold separately)Mid-tower PC cabinet features a show-piece worthy design to add visual appeal to your computer setupHigh airflow-optimised front steel panel offers enhanced cooling by enabling optimum ventilation to the system's interiorTool-free transparent tempered side glass panel showcases your high-end hardware with bright RGB lighting effectsHigh-quality steel and plastic build lasts for years to comeDedicated motherboard tray with customisable fan mounts makes it easy to side-mount up to three 120mm fans or a 360mm radiator for flexible cooling optionsSpacious internal space can hold up to three 2.5"" SSDs and two 3.5"" HDDs along with up to ten 120mm or four 140mm cooling fans at the front/side panels, and a 360mm push/pull radiator at the roofTwo USB 3.0 ports, one USB 3.1 Type-C port, and one headphone/microphone combo jack at the modern front I/O panel provide an array of peripheral connectivity optionsTwo 120mm Corsair fans use advanced AirGuide anti-vortex vanes to concentrate internal airflow for top-notch cooling performanceConvenient Corsair RapidRoute cable management system with 25mm single, hidden channel space behind the motherboard enables effortless cable routing without any visible clutterRemovable front and roof panels allow for easy installation and cleaning of internal components when required",https://multimedia.bbycastatic.ca/multimedia/products/500x500/152/15260/15260468.jpg,Computer Cases
Computer Cases,Corsair iCUE 4000X RGB Mid-Tower ATX Computer Case - Black,189.99,"Compatible with Mini-ITX, Micro-ATX, ATX, and E-ATX (305mm x 277mm) motherboards (sold separately)Compact, mid-tower case offers enough space for advanced hardware to build a high-performing PCDedicated front ventilation channels enable optimal airflow into the case for quick and efficient coolingTempered glass side and front panels showcase your components in style with attractive RGB lighting effectsHigh-quality steel and plastic construction lasts for years of intense useFeatures ample room to fit up to 2 SSDs, 2 HDDs, and six 120mm or four 140mm cooling fans, along with multiple radiators including a 360mm in the front and 280mm on the roof (dependent on RAM height)Three built-in 120mm AirGuideRGB fans use anti-vortex vanes to further improve your system's cooling with concentrated airflowEight individually addressable RGB LEDs on each fan illuminate the rig with bright, attractive lighting effectsCorsair iCUE and Corsair Lighting Node Core software help synchronise and adjust the lighting for up to 6 cooling fans as requiredCorsair RapidRoute cable management system features a 25mm single channel behind the motherboard for neat and clutter-free organisation of all major cables of your componentsModern front I/O panel equipped with one USB 3.0 port, one USB 3.1 Type-C port, and one headphone/microphone combo jack allows for easy device connectivity",https://multimedia.bbycastatic.ca/multimedia/products/500x500/152/15260/15260466.jpg,Computer Cases
Computer Cases,Corsair 4000D Airflow Mid-Tower ATX Computer Case - White,139.99,"Compatible with Mini-ITX, Micro-ATX, ATX, and E-ATX (305mm x 277mm) motherboards (sold separately)Mid-tower case provides ample space to accommodate 2 SSDs, 2 HDDs, and your other essential CPU components (sold separately)High-airflow steel front panel ensures optimal ventilation to prevent heat build-upTwo 120mm AirGuide fans with anti-vortex vanes offer enhanced coolingRoomy interior holds 6x 120mm or 4x 140mm cooling fans, and multiple radiators up to 360mm for great cooling potentialRapidRoute cable management system enables easy and quick routing of all major cables via a single channelSleek front I/O panel with one USB 3.0 port, one USB 3.1 Type-C port, and one headphone/microphone combo jack lets you quickly connect external devices and audio devices (sold separately)Tool-free tempered glass side panel beautifully displays your top-level components and RGB lighting",https://multimedia.bbycastatic.ca/multimedia/products/500x500/152/15260/15260465.jpg,Computer Cases
PC Fans and CPU Coolers,Kopplen LED 120mm Case Fan - Red,14.99,"9 fan-blade with 48.63 CFM capacity expels hot or warm air inside the case to keep the components coolRated for 50,000 hours of life, which means it's built for the long termUltra-quiet design features silent hydraulic bearings and 25.1 dB noise ratingQuality plastic construction for long-lasting useCompatible with PCs",https://multimedia.bbycastatic.ca/multimedia/products/500x500/144/14469/14469338.jpg,PC Fans and CPU Coolers
PC Fans and CPU Coolers,NZXT Kraken X73 RGB 360mm WHITE - AIO RGB CPU Liquid Cooler,"279.99",Rotating Infinity Mirror Design - Improved Pump - 3 x Aer P120 120mm Radiator Fans,https://multimedia.bbycastatic.ca/multimedia/products/500x500/158/15803/15803238.jpeg,PC Fans and CPU Coolers
PC Fans and CPU Coolers,"ASUS ROG RYUJIN II 360 ARGB EVA EDITION all-in-one liquid CPU Cooler 360mm Radiator, ","474.99","3.5 Color LCD, Support AURA SYNC, 3*120mm ROG ARGB Fans",https://multimedia.bbycastatic.ca/multimedia/products/500x500/164/16449/16449979.jpeg,PC Fans and CPU Coolers
PC Fans and CPU Coolers,Corsair LL120 RGB LED PWM 120mm Triple Case Fan Kit - White,149.99,"Three fans with 120mm blades create excellent airflow and static pressurePWM control mode allows speeds between 360 RPM to 2,200 RPM for dynamic adjustments that minimize noise or maximize airflow as desired16 individually addressable RGB LEDs in each fan in two separate loops let you create customised effectsLighting Node PRO included to make setup easy, with CORSAIR iCUE software syncing abaility available so your whole setup stays in-stepWhite fan housing is unique and perfectly matches other white CORSAIR products (sold separately)Compatible with PCs",https://multimedia.bbycastatic.ca/multimedia/products/500x500/154/15454/15454758.jpg,PC Fans and CPU Coolers
PC Fans and CPU Coolers,Corsair iCUE Lighting Node Pro RGB Lighting Controller,79.99,Lighting controller lets you customize and control the RGB lighting using iCUE softwareTwo RG lighting channels offer independent software control of up to 12 RGB LED light strips or 12 RGB fansiCUE software lets you customize and sync RGB lightings of an array of Corsair productsIncludes 4 light strips each featuring 10 independently controllable RGB LEDs with extension cables and built-in magnets for easy installation and illuminationUSB 2.0 port allows you to connect the Lighting Node PRO to the PC for easy installationCompatible with most ATX cases,https://multimedia.bbycastatic.ca/multimedia/products/500x500/141/14193/14193868.jpg,PC Fans and CPU Coolers
PC Fans and CPU Coolers,Corsair iCue QL120 RGB PWM 120mm Triple Case Fan Kit,153.99,"Three fans with 120mm blades create excellent airflow and static pressurePWM control mode allows speeds up to 1,500 RPM for dynamic adjustments that minimize noise or maximize airflow as desired to push around a maximum of 41.8 CFM of air34 individually addressable RGB LEDs in each fan let you create customized effectsLighting Node PRO included to make setup easy, with CORSAIR iCUE software syncing abaility available so your whole setup stays in-stepLow-noise housing with anti-vibration rubber dampers helps ensure quieter operationCORSAIR metal logos on the front and back of the fan hub add extra styleCompatible with PCs",https://multimedia.bbycastatic.ca/multimedia/products/500x500/154/15454/15454757.jpg,PC Fans and CPU Coolers
