category,name,price,description,image,Category
Power Supply Units,Lenovo 65w USB Type-C AC Adapter (AC Power Cord Included),59.99,null,https://multimedia.bbycastatic.ca/multimedia/products/500x500/159/15982/15982597.jpeg,Power Supply Units
Power Supply Units,Corsair HXi 1500-Watt ATX Modular Power Supply,529.99,"Fully modular design upgrades your PC effectively with easy-to connect cables for simple and easy installation1500W consistent power flow to keep up with your intensive games and demanding workflowATX form factor offers durable performance and effortlessly fits into most cabinets140mm Fluid Dynamic Bearing fan (FDB) generates very low noise for quiet performanceResonant LLC topology with DC-to-DC conversion offers standard power while reducing coil whine for steady and quiet operation105-degree Celsius rated, 100% industrial-grade Japanese capacitors deliver consistent power with incredible performanceAssists Modern Standby sleep mode for speedy wake-from-sleep times and enhanced load efficiencyZero RPM fan mode enables silent operation at low to medium loadsTriple HXi Series EPS12V connectors are designed to work well with latest motherboardsCORSAIR iCUE software lets you monitor power settings, enable custom fan curves, and switch between single to multi-rail overcurrent protection (OCP) in a snap80 PLUS Platinum certification ensures up to 92% efficiency for low power consumption, less noise and maintaining optimum temperatures",https://multimedia.bbycastatic.ca/multimedia/products/500x500/163/16355/16355813.jpg,Power Supply Units
Power Supply Units,Corsair RM750x 750-Watt (80 PLUS Gold) Fully Modular ATX Power Supply,149.99,"Fully modular design enables easy connectivity with the cables of your system's hardware750W power supply unit keeps your mid-range PC running efficiently for smooth gaming and multitasking workflowsATX form factor is compact for easy installation in advanced ATX CPU cabinets135mm magnetic levitation bearing fan featuring custom engineered rotors to generate less noise and reliable performanceResonant LLC topology with DC-to-DC conversion minimizes coil whine to ensure quiet operation, delivers consistent power supply, and makes use of sleep states efficiently100% industrial-grade Japanese capacitors with 105-degree Celsius rating offer long-lasting reliability with steady power delivery even at high loadsModern Standby sleep mode support for quick wake-from-sleep times and improved low-load efficiencyZero RPM fan mode operates the PC with virtually no noise during low to medium loadsDual EPS12v connectors offer compatibility with a wide range of modern graphics cards and motherboards80 Plus Gold certified energy efficiency means the PSU delivers reliable power to your PC with less power consumption, reduced heat generation, and low noise levels",https://multimedia.bbycastatic.ca/multimedia/products/500x500/153/15397/15397407.jpg,Power Supply Units
Power Supply Units,Corsair RM 850-Watt ATX Modular Power Supply,179.99,"Completely modular power supply lets you connect only the cables you need for a neat and tidy interior850W power supply with triple EPS12V connectors can supply reliable power to all the latest graphic cards, processors, and other performance hardware140mm rifle-bearing fan is fine tuned to keep noise minimum even when running at full loadZero RPM Fan Mode turns the fan off when running at low or medium loads for almost noiseless operationCompatible with Modern Standby for low-load efficiency and quick wake-up time from sleepResonant LLC Topology supplies clean and steady power with low coil whining and executes energy efficient sleep states105-degrees C rated capacitors are industrial grade and capable of powerful electrical performance and long-term reliability80 PLUS GOLD certification means this power supply boasts up to 90% efficiency in power consumption which means less power is wasted",https://multimedia.bbycastatic.ca/multimedia/products/500x500/159/15950/15950136.jpg,Power Supply Units
Power Supply Units,Corsair RM 1000-Watt ATX Modular Power Supply,269.99,"Fully modular design lets you only connect the cables that your system requires1000-watt power supply suits high-level computer enthusiasts who demand more powerATX form factor permits simultaneous power supply to all the motherboard components while ensuring durable performance135mm ML fan with a magnetic levitation bearing and custom engineered rotors offer increased performance, low noise, and greater reliabilityResonant LLC topology with DC-to-DC conversion ensures clean and consistent power while lessening coil whine for hush operation, and also facilitates use of more energy efficient sleep statesReliable 105degrees Celsius rated, 100% industrial-grade Japanese capacitors produce constant power supplyAssists Modern Standby sleep mode for superfast wake-from-sleep times and improved load efficiencyZero RPM fan mode provides almost-near silent operation at low to medium loadsTwo EPS12V connectors permit new graphic cards and motherboards80 PLUS Gold certified efficiency makes it low on power consumption and noise while offering cooler temperatures",https://multimedia.bbycastatic.ca/multimedia/products/500x500/153/15397/15397406.jpg,Power Supply Units
Motherboards,Asus ROG Strix X570-E Gaming Desktop Motherboard - AMD Chipset - Socket AM4 - ATX,481.99,null,https://multimedia.bbycastatic.ca/multimedia/products/500x500/157/15765/15765965.jpeg,Motherboards
Motherboards,MSI B550M PRO-VDH WIFI Micro-ATX LGA AM4 Motherboard,159.99,"Socket LGA AM4 allows you to utilize the potentials of Ryzen 5000, 3000, and 4000 G-series processorsMicro-ATX form factor offers plenty of space to plug in your hardware componentsFour dual-channel memory slots let you handle DDR4 memory modules with speeds up to 4400 MHzOn-board Wi-Fi 5 (802.11ac) and RJ45 port offer both wireless and wired connectivity optionsOne PCIe 4.0 x16 and two PCIe 3.0 x1 slots let you install graphics, sound, and networking cardsFour SATA III and two M.2 ports let you connect to a multitude of hard drives for superior program loading and improved overall performanceIntegrated 7.1-channel high-definition audio delivers clear, crisp, and immersive audio experienceCompatible only with Windows 10 (64-bit) operating systems",https://multimedia.bbycastatic.ca/multimedia/products/500x500/157/15799/15799610.jpg,Motherboards
Motherboards,Gigabyte Motherboard B450 AORUS PRO WIFI AM4 AMD Ryzen B450 64GB DDR4 ATX Retail (B450 AORUS PRO WIFI),217,null,https://multimedia.bbycastatic.ca/multimedia/products/500x500/129/12908/12908721.jpeg,Motherboards
Motherboards,MSI PRO X670-P WIFI AM5 ATX Motherboard,399.99,"AM5 CPU socket lets you extract the full potential of AMD Ryzen 7000 Series desktop processorsATX form factor features a spacious layout which makes switching and installing hardware components simple and easySupports up to 128GB of DDR5 RAM with 4 memory slots having dual-channel architectureSupports overclocking the RAM to gain some extra performance when handling heavy duty operationsPCIe 5.0 x16 graphics card slot provides higher data throughput that significantly speeds up graphic processing speedsFour M.2 slots let you expand your storage capacity to immense proportionsTwo PCIe x16 slots and 1 PCIe 3.0 x1 slot for installing soundcards and other PCI-based hardwareIntegrated Realtek 8125BG Gigabit Ethernet port and AMD RZ616 Wi-Fi 6E provide blistering-fast speeds with low latency over wired and wireless networksDisplayPort output provided for connecting to monitors, TVs, and other video devicesFour USB 3.1 ports, 1 USB 3.1/3.2 Gen 2 port, and 1 USB-C port provide comprehensive connectivity for plugging several devices and accessoriesSix SATA III 6GB/s ports let you further expand your storage options with SATA hard drives and SATA solid state drives",https://multimedia.bbycastatic.ca/multimedia/products/500x500/164/16480/16480086.jpg,Motherboards
Motherboards,ASUS ROG Strix B450-F Gaming II ATX AM4 Motherboard,174.99,"AM4 socket is compatible with first, second, and third generation AMD RyzenCPUs as well as first and second generation AMD Ryzen with Radeon Vega GPUsATX form factor is ideal for gaming and offers lots of space for plugging in hardware componentsConnectivity includes dual M.2 slots for NVMe SSDs and 16 slots of 2 x PCIe 3.0 for connecting high speed storage devices and other peripheralsFour dual channel DDR4 RAM slots support up to 128GB memoryCrossFireX ready motherboard lets you combine multiple GPUs for increased performanceHDMI 2.0b port and DisplayPort 1.2 for connecting monitors and display devices capable of 4K resolution at 60HzUSB 3.2 Gen 2 Type-A port, USB 3.1 Gen 2 Type-A port, and Type-C ports for plugging in smartphones, external storage media, and other devicesSupremeFX S1220A codec with DTS Sound Unbound and Sonic Studio III generates rich and clear audio to give you an immersive gaming actionASUS AI Noise Cancelling Mic technology ensures your voice chats are more clear and crispExtended VRM and PCH heatsinks, M.2 heatsinks, additional hybrid headers for fans, and Fan Xpert utility for controlling fan speed help maintain optimal temperatures, even during long hours of gamingASUS-exclusive Aura Sync RGB lighting with Armoury Crate utility come with 2RGB headers and a Gen 2 addressable RGB header for hassle-free personalization of the lighting effectsBIOS FlashBack and ASUS exclusive UEFI BIOS along with 256Mb BIOS Flash ROM and Pre-mount I/O shroud allow easy update to the latest versions, so your gaming performance is not hindered",https://multimedia.bbycastatic.ca/multimedia/products/500x500/153/15397/15397881.jpg,Motherboards
Motherboards,ASUS AM4 TUF Gaming X570-Plus ATX motherboard,288.99,null,https://multimedia.bbycastatic.ca/multimedia/products/500x500/138/13818/13818980.jpg,Motherboards
Motherboards,Asus Prime PRIME A320M-K Desktop Motherboard - AMD A320 Chipset - Socket AM4,93.99,null,https://multimedia.bbycastatic.ca/multimedia/products/500x500/125/12552/12552900.jpg,Motherboards
Motherboards,ASUS ROG Strix Z690-E ATX LGA1700 Motherboard,599.99,"LGA1700 socket is designed for the powerful 12th Gen Intel Core processorsFour DIMM slots support up to 128GB of unbuffered dual channel DDR5 memory with maximum clock speed of up to 6400MHz (OC)ATX form factor is large and spacious which makes installing and switching components more convenientOne PCIe 5.0 M.2 x 16 slot with bundled ROG Hyper M.2 card and 3 M.2 slots with PCIe 4.0 and PCIe 3.0 for expansive solid state storage optionsBuilt-in 2 x 2 Wi-Fi 6E (802.11 a/b/g/n/ac/ax) and Intel 2.5Gb Ethernet with ASUS LANGUARD provide blazing fast network performance for online multi-player gamingBluetooth 5.2 for pairing with compatible devices such as headsets, speakers, and moreOne DisplayPort 1.4 with up to 8K at 60Hz support and HDMI 2.1 port that supports up to 4K at 60HzThree USB 3.2 Gen 2 ports (2 x Type-A, 1 x USB Type-C), four USB 3.2 Gen 1 ports (4 x Type-A), and four USB 2.0 ports (2 x Type-A) on the rear and one USB 3.2 Gen 2x2 connector with USB-C support, one USB 3.2 Gen 1 header that supports extra two USB 3.2 Gen 1 ports, and two USB 2.0 headers that support up to four USB 2.0 ports for the front panelBuilt-in ROG SupremeFX 7.1 Surround Sound High Definition Audio CODEC ALC4080 with Savitech SV3H712 amplifier, DTS Sound Unbound, and Sonic Studio III produces industry-leading audio performance in playback and recordingAI features include AI overclocking, AI cooling, AI networking, and AI noise cancellation to maintain and manage high-end builds efficientlySolid power solution with 18+1 power stages, high quality alloy chokes, and durable capacitors to handle the demanding load of multi-core processorsVRM heatsink, PCH fanless heatsink, double-sided M.2 heatsink, hybrid fan headers, and FanXpert 4 utility for thermal control and quick heat dissipationASUS-exclusive Aura Sync RGB lighting with RGB headers and Gen 2 addressable headers for connecting lighting accessories",https://multimedia.bbycastatic.ca/multimedia/products/500x500/164/16469/16469871.jpg,Motherboards
Motherboards,Asus ROG Cross X670E Hero Motherboard,909.99,"AMD Socket AM5(LGA 1718) for AMD Ryzen 7000 Series desktop processorsAI Cooling II and two-way AI noise cancelation help with easy configuration and intelligent control18 + 2 teamed power stages rated for 110A, ProCool II power connectors, MicroFine alloy chokes and premium metallic capacitors Optimized thermal design with large VRM heatsinks plus integrated aluminum I/O cover, high-conductivity thermal pad, five M.2 heatsinks and three with embedded backplates, plus the ROG Water Cooling ZoneOnboard Wi-Fi 6E, Intel 2.5 Gb Ethernet, and Asus LANGuard provide high-performance networkingPCIe 5.0 expansion slot, dual PCIe 5.0 M.2 onboard slots, M.2 card with PCIe 5.0 support, USB 3.2 Gen 2x2 header with Quick Charge 4+ support, and dual USB4 Type-C ports offer fast gaming connectivityROG SupremeFX ALC4082 with ESS® ES9218 QUAD DAC for pinpoint positioning and dynamicsI/O cover with Polymo Lighting, ASUS-exclusive Aura Sync RGB lighting, one RGB header and three addressable Gen 2 RGB headersPre-mounted I/O shield, PCIe Slot Q-Release, BIOS FlashBack™, Q-Code, FlexKey, Q-Connector, M.2 Q-Latch, SafeSlot, PCIe® 5.0 M.2 card and ROG Graphics Card HolderBundled 1-year AIDA64 Extreme subscription and intuitive UEFI BIOS dashboard",https://multimedia.bbycastatic.ca/multimedia/products/500x500/164/16486/16486607.jpg,Motherboards
Motherboards,Asus Prime B550M-A WIFI II Desktop Motherboard,204.99,null,https://multimedia.bbycastatic.ca/multimedia/products/500x500/164/16445/16445728.jpeg,Motherboards
Motherboards,MSI MAG B550 Tomahawk ATX AM4 Motherboard,199.99,AM4 socket supports 2nd- and 3rd-generation AMD Ryzen processors to offer a smooth multi-tasking and gaming experienceATX form factor allows you to easily customise the PC hardwareFour dual-channel DDR4-2666 RAM (OC) slots allows you to add up to 128GB of memoryPCIe 4.0 x16 slots for graphic cards enables an excellent gaming experienceLightning Gen 4 M.2 slots with up to 64GB/s transfer speeds for fast onboard storageIntegrated 2.5GbE + 1GbE port allows for exceptionally fast data transfer speedsRealtek ALC1220 7.1-channel HD codec support offers the option for you to enjoy high-definition audio,https://multimedia.bbycastatic.ca/multimedia/products/500x500/149/14970/14970045.jpg,Motherboards
Motherboards,MAXIMUS XIII HERO ATX LGA1200 Motherboard,449.99,"Intel LGA 1200 socket helps to utilize the maximum potential of the 11th Gen Intel Core processorsATX form factor and DIY-friendly design like pre-mounted I/O shield, Q-Code, FlexKey, BIOS FlashBack, SafeSlot, Q-Connector and graphics card holder offer plenty of options for customizing your gaming computerOnboard Wi-Fi 6E (802.11ax), dual Intel 2.5 Gb Ethernet, and ASUS LANGaurd provide superior networking capabilityPCIe 4.0, dual USB Type-C ports with Thunderbolt 4 USB-C and quad M.2, USB 3.2 Gen 2x2 front-panel connector offer more options for connecting external devicesAI-enhanced motherboard that features utilities like AI overclocking, AI cooling, AI networking, and AI noise cancelation for exceptional performanceProCool II power connectors, 90 Amp rated 14+2 power stages, 10K Japanese-made metallic capacitors and MicroFine alloy chokes offer extremely reliable and strong power solutionEnlarged VRM heatsinks, built-in aluminum I/O cover, highly conductive thermal pad, ROG Water-Cooling Zone, and quad M.2 heatsinks with pre-fixed backplates enable optimized thermal performanceROG SupremeFX ALC4082 with ESS ES9018Q2C DAC enables superior quality gaming audioCustomizable Aura Sync RGB lighting with RGB headers and Gen 2 addressable headers give a stunning look to your high-end gaming buildAIDA64 Extreme subscription (1-year) and UEFI BIOS dashboard with integrated MemTest86 make it easy to manage your installed hardware/software and related issues",https://multimedia.bbycastatic.ca/multimedia/products/500x500/153/15396/15396652.jpg,Motherboards
Motherboards,ASUS Prime Z690-A ATX LGA 1700 Motherboard,359.99,"Intel LGA 1700 socket helps to utilize the maximum potential of the 12th Gen Intel Core, Pentium Gold, and Celeron processorsATX form factor and DIY-friendly design offer plenty of options for customizing your gaming computerSupports up to 128GB of dual-channel DDR5 RAM for a smooth performanceEquipped with 16+1 DrMOS, ProCool sockets, alloy chokes and durable capacitors for stable power delivery and enhanced performanceAI-enhanced motherboard features utilities like AI overclocking, AI cooling and Two-way AI noise cancellation for enhanced performanceDesigned with large VRM heatsink, M.2 heatsink, M.2 backplate with Q-Latch, hybrid fan headers and Fan Xpert 4 to maintain optimal temperatures, even during long hours of gamingCareful routing of traces and vias, plus ground layer optimizations to preserve signal integrity for improved memory overclocking with ASUS OptiMem IINew Prime aesthetics include New ID design and sliver scheme to give a stunning lookASUS-exclusive Aura Sync RGB lighting with RGB headers and Gen 2 addressable header for hassle-free personalization of the lighting effectsDDR5 memory, PCIe 5.0, Intel 2.5 Gb Ethernet, USB 3.2 Gen2x2 Type-C, front panel USB 3.2 Gen 2 Type-C, Thunderbolt 4 header support offer fast connectivity options",https://multimedia.bbycastatic.ca/multimedia/products/500x500/157/15799/15799275.jpg,Motherboards
Motherboards,ASUS ROG Strix B550-F Gaming Wi-Fi II ATX AM4 Motherboard,229.99,"AM4 Socket supports AMD Ryzen 3000 and 5000 Series as well as 5000 and 4000 G-Series desktop processors12"" x 9.6"" ATX form factor is spacious and makes adding and removing components easierOnboard integrated dual-band 802.11ax Wi-Fi 6E and Intel 2.5Gb Ethernet for high-speed connectivity to wired and wireless networksASUS LANguard protects against power spikes while ensuring reliable signal delivery and lower packet loss rate which leads to less lag in gamesIntegrated Bluetooth 5.2 for pairing with compatible devices such as wireless speakers, connecting wireless keyboard/mouse, and moreOne HDMI 2.1 port and 1 DisplayPort 1.4port pump out superior visuals at high resolutions and smooth frameratesTwo USB 2.0 ports, 8 USB 3.1/3.2 Gen 2 ports, and optical S/PDIF port for connecting a wide range of devices and peripheralsTwo M.2 slots and 6 SATA 6GB/s ports for connecting high-speed storage components such as SSDsROG supreme FX 7.1 channel audio for 2-way noise cancellation, DTS Sound Unbound, and Sonic Studio III for achieving clear and high definition playback and recordingFour DIMM DDR4 RAM slots let you expand your system memory up to 128GBPCIe 4.0 x16 slot with x4 support gives you faster loading times and a more responsive operating systemThree PCIe X1 slots for inserting network cards, TV tuner cards, sound cards, and other low throughput hardware for added functionalityBundled with 60-day AIDA64 Extreme subscription and UEFI BIOS dashboard for managing and monitoring the motherboard functionsROG-exclusive software includes RAMCache III, ROG CPU-Z, GameFirst VI, Sonic Studio III, Sonic Studio Virtual Mixer, Sonic Rader III, DTS Sound Unbound, and Overworlf for added functionality and system monitoringAI Suite 3 comprises of Performance and Power Saving Utility, EPU, DIGI + VRM, Fan Xpert 4, TurboV Evo, EZ update, WinRAR, DAEMON Tools, and Norton Anti-virus software (free trial) for optimizing and tweaking system hardwareASUS-exclusive Aura Sync RGB Lighting lets you personalize your gaming setup with all various lighting themesCompatible with Windows 10 64-bit and Windows 11 64-bit operating systems",https://multimedia.bbycastatic.ca/multimedia/products/500x500/157/15799/15799276.jpg,Motherboards
Motherboards,MSI PRO Z690-A ATX LGA 1700 Motherboard,254.99,"Based on Intel Z690 chipset architecture, the Pro Z690-A's LGA 1700 socket allows you to install the latest Intel 12th Generation Alder Lake processorsATX form factor features an extended heatsink design for smooth, cool operation so you can enjoy nonstop gamingEquips with 18+1+1 phases direct power design with Core Boost technology for high-performance gaming sessionsAn aggressive digital VRM power design with digital PWM IC and direct 18 phases CPU power System with 75A Smart Power StageDual 8pin power connectors and exclusive Core Boost technology ensure best conditions for the challenge of high-end processorsFour dual channel DDR5 memory slots allow you to add up to 128GB of RAMOne PCIe 5.0 X1 slot, one PCIe 5.0 X16 slot, six SATA III ports, and four M.2 slots are available to maximise performanceMultiple USB ports, HDMI, and Display Port give you plenty of connectivity options",https://multimedia.bbycastatic.ca/multimedia/products/500x500/157/15795/15795814.jpg,Motherboards
Motherboards,Asus TUF X670E-PLUS Gaming Wi-Fi 6E Motherboard,428.99,"AMD AM5 socket is ready for AMD Ryzen 7000 Series desktop processors14+2 teamed power stages, eight-layer PCB, 8+8 ProCool sockets, alloy chokes and durable capacitors for stable power deliveryNext-gen connectivity with PCIe 5.0, USB 3.2 Gen2x2 Type-C, front USB 3.2 Gen 2 Type-C, USB4 supportWith Realtek 2.5 Gb Ethernet, WiFi 6E, and TUF LANGuard, it's made for next-level gaming Reduces background noise from the microphone and audio output for crystal-clear communication in games or video conferencesSports the new TUF Gaming logo, and incorporates simple geometric design elements to reflect the dependability and stability that defines the TUF Gaming seriesEnlarged VRM and PCH heatsinks, M.2 heatsinks, hybrid fan headers and Fan Xpert 4 utility in Armoury CrateStylish edge lighting design, addressable RGB headers and RGB strip header support.",https://multimedia.bbycastatic.ca/multimedia/products/500x500/164/16486/16486608.jpg,Motherboards
Motherboards,ASUS PRIME Z590-A ATX LGA1200 Motherboard,319.99,"Intel LGA 1200 Socket brings out the top performance of 11th Gen and 10th Gen Intel Core processorsSupports Pentium Gold and Celeron Processors, Intel 14 nm CPU, Intel Turbo Boost Technology 2.0 and Intel Turbo Boost Max Technology 3.0 depending on the CPU typesReliable ATX form factor comes with its larger expansion slots, limited cable usage, modern I/O standard support, and reduced costFront USB 3.2 Gen 2 Type-C and Thunderbolt 4 header and Triple M.2/NVe SSD scale up your productivityAI overclocking, AI cooling, and AI noise cancelation for a free flowing, heat-free and noiseless performance14+2 DrMOS power stages, ProCool sockets, alloy chokes, and long-lasting capacitors offer constant power delivery during challenging situationsVRM heatsink, PCH heatsink, hybrid fan headers, and Fan Xpert 4 utility generate ample cooling for sustained performanceCautious routing of traces and vias, and ground layer optimizations maintain signal integrity for improved memory overclocking with ASUS OptiMem IIASUS-exclusive Aura Sync RGB lighting, including RGB headers and Gen 2 addressable headers keep you entertained with customized lighting optionsRealtek S1220A codec keeps you hooked to all the gaming action and also improves your most-played music tracks or videos with its impeccable audio qualityASUS AI Noise Cancelling Mic technology lets you communicate clearly without any noise hindrance",https://multimedia.bbycastatic.ca/multimedia/products/500x500/153/15396/15396655.jpg,Motherboards
Motherboards,Asus Strix X670E-E Gaming Wi-Fi 6E Motherboard,649.99,"AMD Socket AM5(LGA 1718) for AMD Ryzen 7000 series desktop processors Asus-exclusive tools including AI Cooling II, Two-Way AI Noise-Cancelation and AI Networking for easy configuration18 + 2 teamed power stages with 8+8 pin ProCool II power connectors, high-quality alloy chokes and durable capacitors to support multi-core processorsLarge VRM heatsinks plus integrated aluminum I/O cover, high-conductivity thermal pad, L-shaped heatpipe, M.2 Combo-sink and M.2 backplate for PCIe 5.0 M.2_1 slot, three on board M.2 heatsinks, plus a massive bundled PCIe 5.0 M.2 heatsink as accessoryOnboard WiFi 6E, Intel 2.5 Gb Ethernet and Asus LANGuard for high-performance networkingDual PCIe 5.0 slots, triple Gen 5 M.2 slots onboard, USB 3.2 Gen 2x2 front-panel connector, and Thunderbolt 4 header offer fast gaming connectivityROG SupremeFX ALC4080 with Savitech SV3H712 amplifier, along with DTS® Sound Unbound and Sonic Studio III ASUS-exclusive Aura Sync RGB lighting, including one RGB header and three addressable Gen 2 RGB headersPower button, Pre-mounted I/O shield, PCIe Slot Q-Release, M.2 Q-Latch, Q-Code, Q-LED, BIOS FlashBack™, Clr CMOS Button, FlexKey , SafeSlot and Safe DIMMBundled 60-day free trial of AIDA64 Extreme, and intuitive UEFI BIOS dashboard",https://multimedia.bbycastatic.ca/multimedia/products/500x500/164/16486/16486609.jpg,Motherboards
